{
  "$schema": "https://github.com/Viktorxyz/opencode-delivery/schema/project-adapter.schema.json",
  "contractVersion": 1,
  "repository": {
    "remote": "origin",
    "defaultBranch": { "discover": true }
  },
  "forge": {
    "driver": "github",
    "issueRequired": true,
    "draftAfterFirstCommit": true,
    "issueClosingSyntax": true
  },
  "worktree": {
    "root": ".worktrees",
    "branchTemplate": "{actor}/{slug}",
    "bootstrap": [["<project-owned-bootstrap-argv>"]]
  },
  "verification": {
    "commands": [
      { "id": "canonical", "argv": ["<project-owned-canonical-argv>"], "timeoutMs": 1200000 }
    ],
    "requireCleanDiffAfter": true,
    "invalidateOnHeadChange": true
  },
  "review": {
    "agent": "delivery-reviewer",
    "required": true,
    "invalidateOnHeadChange": true
  },
  "ci": {
    "driver": "github-status-checks",
    "requiredChecks": ["delivery-verify"],
    "wait": true,
    "flakyRetry": 1
  },
  "ready": {
    "requires": ["review", "local-verification", "remote-ci"],
    "stopAfterReady": true
  },
  "merge": {
    "strategy": "squash",
    "policy": "explicit-user-request-only",
    "requireFreshGates": true
  },
  "cleanup": {
    "when": "next-task",
    "requires": ["pr-merged", "worktree-clean", "no-unpublished-commits"]
  }
}